Photo Profile;User Name;Sentimen;Sejak Comment;Comment;Jumlah Like Comment
https://lh3.googleusercontent.com/a-/ALV-UjWDKPpqvBndgbwUPm7n6imuMAuUp-JqvMIQWff_Dk9n5yYa=w45-h45-p-rp-mo-ba3-br100;Kimberly Lauw;Positive;2 bulan lalu;Tempatnya cukup nyaman mau cari apa juga lengkap cuma karena semi outdoor jadi agak panas kalo kesini siang siang, banyak pameran menarik dan event event seru juga, kalau weekend lumayan padet sih tapi masih cukup nyaman, payment parkir harus cashless;0
https://lh3.googleusercontent.com/a-/ALV-UjXpcPZCzurZ2GJHynY_PYJPH_9y0Myt7FtmNcDMDlSV4iw=w45-h45-p-rp-mo-ba5-br100;Andry Andika;Positive;5 bulan lalu;Tempat nongkrong dan belanja menengah atas di Bandung. Ada tmpt makan di bawah dan di atas. Dan toko2 pakian asesories serta buku tersedia di sini. …;5
https://lh3.googleusercontent.com/a-/ALV-UjUYQh20ZxJSQvmHy7pf9nt-AaYbEhFXFPdcIyA92YnEvQk=w45-h45-p-rp-mo-ba4-br100;Gunarti Prawintana;Positive;seminggu lalu;Mall nya luas banyak outdoor tapi sepertinya sedang byk progress renovasi;0
https://lh3.googleusercontent.com/a-/ALV-UjVHZEgcECC7gkHCfm2vTDWeFgCVnsCUDxZtRZbuL071qfH3=w45-h45-p-rp-mo-ba7-br100;Arief Alvianto;Positive;4 bulan lalu;Mall nya cukup lengkap,banyak brand. Suasanya berbeda dengan mal2 building.;13
https://lh3.googleusercontent.com/a-/ALV-UjXQgQ3-D0heW0CID4Jcri6LWbHfINgb-nM1LGFi9PYgfQ=w45-h45-p-rp-mo-ba4-br100;nurul fatimah;Positive;4 bulan lalu;Mall paling seru di bandung, suasananya beda banget sm mall yang lain. Banyak tempat makan dan permainan anak. Asri banyak tanaman dan ada binatang ternak di lantai atas;0
https://lh3.googleusercontent.com/a-/ALV-UjXIXB8O-2ksR9RFUHsVCb-Cw5r9LUQvHfur-1OxI9VcfZE=w45-h45-p-rp-mo-ba4-br100;Mauly Arla;Positive;2 bulan lalu;baru pertama kali kesini, tempatnya bagus dan luas cocok untuk bermain, makan, nongkrong, namun disini tidak ada supermarketnya;0
https://lh3.googleusercontent.com/a-/ALV-UjWFJbfjfMLQ67ieh9DJ0Q_nYiBR0HnuFqcEhr3uK8lzonQ=w45-h45-p-rp-mo-ba4-br100;Rima Apriani;Positive;4 bulan lalu;Mallnya lumayan besar dan Kumplit untuk brand2 ternama. Suasananya juga rame banget. Lokasinya juga ga gitu susah. Karna dipusat kota.;0
https://lh3.googleusercontent.com/a-/ALV-UjVUL2FzmcD02kU2J7209uryYnkgdk4PcDS7trOIPYLC_s0=w45-h45-p-rp-mo-ba5-br100;agustinus “zags” hermulianto;Positive;2 bulan lalu;Mall nya luas dan banyak toko fashion, sepatu serta makanan dan minuman. Lahan parkir yang disediakan juga luas. Ada mushalla di lantai ground.;0
https://lh3.googleusercontent.com/a-/ALV-UjUMruNNhjwBkkphEpfITnQFH7RcNh93nlDALQpgkneNaL9L=w45-h45-p-rp-mo-ba5-br100;Sindi Novita;Positive;7 bulan lalu;Pusat perbelanjaan yang terhitung besar di bandung dan segala brand mewah ada di sini. Tempatnya luas, dengan berbagai macam pemenuh kebutuhan dari mulai belanja fashion, rumah tangga, kuliner, hiburan anak, kendaraan, lengkap pokoknya. …;0
https://lh3.googleusercontent.com/a-/ALV-UjWWFe1vaDKG79wSFCMvZ2ccVENtNaYBbCUAeWQ_quodUQpT=w45-h45-p-rp-mo-ba5-br100;Maulana Muhtadi;Positive;3 minggu lalu;Tempat ini merupakan pusat perbelanjaan  yang besar dengan konsep seperti pedestrian atau seolah kita berjalan jalan di jalanan kota namun semuanya dalam satu lokasi gedung. Di bagian atas kalian bisa jalan jalan dengan suasana asri seperti …;0
https://lh3.googleusercontent.com/a-/ALV-UjVGAr8EmeiFTqriJfYgmzQCzgY298KY5cNlMGpOktHfyxg=w45-h45-p-rp-mo-ba6-br100;Julie Gustiyawan;Positive;9 bulan lalu;Siapa sih yang gx suka belanja ia nga sih apalagi kaum hawa,jarang banget yang gx suka belanja,apalagi ke tempat lengkap seperti pvj ini,banyak pilihan untuk shopping,sekedar cuci mata,nongkrong,makan jaalan² so pasti dalam satu tempat …;2
https://lh3.googleusercontent.com/a-/ALV-UjXaRbrX_8lhw8rFJjfvElA-chFlgfmjTFG4r8M5E628pUs=w45-h45-p-rp-mo-ba6-br100;IC Chanel68;Positive;7 bulan lalu;Mall ini lumayan luas terdiri dari 3 lt dan lantai paling atas konsepnya mirip dg Bugis Street. Jika anda datang dengan mobil sebaiknya parkir di area atas, jika di basement sempit dan harus hati2 karena diperuntukkan untuk mobil kecil …;8
https://lh3.googleusercontent.com/a-/ALV-UjVP-x0aMmudEQVWCAuiz1hMpOfs9dAkCrjySBHgz7yGIeo=w45-h45-p-rp-mo-ba4-br100;Anun Masnun;Positive;setahun lalu;Kesini pas liburan ke Bandung. Sebenarnya ini mall yg keren, konsepnya keren, toko2 nya jg brand2 terkenal dan resto nya jg banyak yg enak2. Tp kesan kurang terawat terlihat di area paling atas, mgkn efek bekas pandemi jg, pdhl 2 thn yg …;2
https://lh3.googleusercontent.com/a-/ALV-UjXZLtv_JGt5wOBzkJTXXU-xm549J4icWWJnlRrOH2SAuZaT=w45-h45-p-rp-mo-ba5-br100;Mamak Tajir;Positive;9 bulan lalu;Duluuu banget waktu awal2 berdiri.. Toilet dan mushola pvj ini bagus banget.. Tapi sekarang mushola nya makin kecil dan toilet nya berbau.. Sayang banget untuk mall sebagus ini.. Moga bisa diperbaiki.. Btw kemarin tanggal 4 feb 2023 ada school fair dan stand2 makanan dan cemilan..;0
https://lh3.googleusercontent.com/a-/ALV-UjVGBlisN19ZefbQY7Gj7ty0zThQmi0Y9sZUQB7KucdPXbU=w45-h45-p-rp-mo-ba4-br100;Yunita Simon;Positive;sebulan lalu;Mall yang masih cukup hype di bandung, tenant lengkap dan suasana enak. Tapi WC nya sedikit banget untuk mall sebesar ini, lokasi WC nya jauhhh2 dan bbrp rusak, sering kotor juga, kalau lg penuh antri. Eskalator naik di dekat tous les jours …;0
https://lh3.googleusercontent.com/a/ACg8ocK9RV2wmQ7qSRtSwo3WLrtGClVan8p6aMfrHDpV40ZE=w45-h45-p-rp-mo-ba3-br100;Rahel Oktavianty;Positive;5 bulan lalu;mall yg berbeda dr yg lain karena di dalamnya  ada air terjun, kebun binatang dan taman bunga.;0
https://lh3.googleusercontent.com/a-/ALV-UjXevHq5Yeg9v9oZKbxstk-kcif5iwmVVMjmOzQilnSRlUtO=w45-h45-p-rp-mo-ba3-br100;Pinesia Juliana;Positive;sebulan lalu;Storenya lengkap tp toiletnya berjauhan dan ngantriiii bgt, sabtu kmrn penuh bgt mau makan semua penuh dan sangat gerah (padahal semi outdoor), kesini krn lg tema menyambut haloween ada decorationnya bikin anak happy;0
https://lh3.googleusercontent.com/a-/ALV-UjWitCyhn80l7XZOOCRcverlZXSohO53-7mFqviBWbQKgAin=w45-h45-p-rp-mo-ba4-br100;Andy Yus Nugroho;Positive;3 bulan lalu;Tempat yang cocok buat jalan-jalan, belanja dan makan.;0
https://lh3.googleusercontent.com/a-/ALV-UjUg-3eL9lrB1Ihmh2GufqJDdGxrm4VCbMWiwbfuN_3SSIpl=w45-h45-p-rp-mo-ba3-br100;Muh Arman Kurniawan;Positive;sebulan lalu;Mampir sini buat ketemu saudara yang tinggal di Bandung. Mall dengan keunikan tersendiri yang sulit ditemui di Jakarta, yaitu adanya berbagai wahana tersedia di outdoor. Dalemnya lumayan luas, tapi nggak bikin tersesat kayak di PI hahaha. …;0
https://lh3.googleusercontent.com/a-/ALV-UjXt23aa4U8V7mpY7EhEB_a9sVdySuK6Vj5cAMPCZB1cxg=w45-h45-p-rp-mo-br100;Riska Amalia;Positive;sebulan lalu;Sebelum pindah ke Jakarta, tiap hari kesini udah macem kuncen (karena gym disini). Mallnya asik buat nongki, dan banyak outdoornya. Parkiran ada depan dan gedung parkir (lurus lagi masuk via karang tinggal setelah kantor polisi). Cuma ga ada ATM B*A aja, dan toiletnya mencar2.;0
https://lh3.googleusercontent.com/a-/ALV-UjV5adV71AlhZkWjOTsI3q9lB1WSLeEl76sOD-KIFpQJKQ=w45-h45-p-rp-mo-ba3-br100;Adek Trisno;Positive;3 minggu lalu;Mall yang cukup unik dan besar di Bandung, menarik untuk didatangi karena ada banyak store dan resto, ada permainan ice skating dan rooftop untuk bersantai-santai, hanya saja akses ke sini lumayan macet.;0
https://lh3.googleusercontent.com/a-/ALV-UjWhfuTt5sig7tPuLkPlLLcacVZoy2g5ar2pN3EdbqNTUmM=w45-h45-p-rp-mo-ba5-br100;akbar kesuma;Positive;6 hari lalu;Tempatnya luas, enak buat jalan bersama keluarga, banyak ragamnya tapi toiletnya ga asik, jauh-jauh. Gak ada toilet khusus anak, padahal ini tu mall cocok untuk keluarga. Kalau hujan banyak yg bocor.;0
https://lh3.googleusercontent.com/a-/ALV-UjX6g9RDouZwvTA0R6u8-VgPD44vkXSBaX6JAzNGSiEkWGIC=w45-h45-p-rp-mo-ba5-br100;Kohen Lie;Positive;setahun lalu;Baru pertama kesini, tempatnya cuma 2 lantai tapi lumayan luas, type mall keluarga buat kumpul and hangout. Banyak tenant2 makanan dari yg murah ke yg mahal.  Ada beberapa space yg kosong harusnya sih bisa dijadiin duit..hahah..;4
https://lh3.googleusercontent.com/a-/ALV-UjUmlExBWT8QXI5AADzma_7larssxVfYEvP9NLCFVaAprQo=w45-h45-p-rp-mo-ba4-br100;Ika Mustikawati;Positive;seminggu lalu;Mall yang sangat aesthetic.. Namun di parkiran basement dan Glamour Level, tercium bau tidak sedap yang sepertinya dari saluran selokan atau got;0
https://lh3.googleusercontent.com/a-/ALV-UjU5nnB39Wf64cP5ScKqZkaa57ZJvJRUzGN3Wec3kpodVw=w45-h45-p-rp-mo-br100;Green Leaves;Positive;sebulan lalu;Bagus. Kekurangannya di mushala. Sebaiknya mushala dibuat ruang tertutup, tempat wudhu dan shalat laki2 dan perempuan terpisah atau menggunakan sekat yg benar2 menutup, jadi saat perempuan berwudhu tidak khawatir auratnya (rambut, kaki, …;0
https://lh3.googleusercontent.com/a-/ALV-UjXJ3Ys7aSa3lPKAdAI8ZjXGTcGRATmMxZhm4E_gU3pYCb4=w45-h45-p-rp-mo-br100;Budi Santoso;Positive;2 minggu lalu;Parkir n traffic nya yg ribet maceutt. Overall Mall nya nyaman dikunjungi.  Public Toiletnya  lebih diperhatikan lagi penempatannya, jangan 1 area toilet per 1 lantai, jauh jaraknya n cukup ribet nyari nya;0
https://lh3.googleusercontent.com/a-/ALV-UjUljWfC0kAmYhzoqcODJ4df1j5UA5KOuHMcDiVItM_C5W0=w45-h45-p-rp-mo-br100;Nur Ani Badriyah;Positive;11 bulan lalu;Desain mall nya berbeda dengan mall lain jadi unik, saat berada didalam mall rasanya seperti di tempat outdoor. Cukup banyak pilihan outlet-outletnya;0
https://lh3.googleusercontent.com/a-/ALV-UjVQHYUgAPJ6yNxBdlTkcH6rYczbUanuICQyxuRvIpn2Vns=w45-h45-p-rp-mo-ba5-br100;cv trirasa;Positive;3 bulan lalu;Yang selalu saya apresiasi dari PVJ adalah parkiran mobil yang banyak, dengan pilihan spot ada yg outdoor, indoor--(sayap kiri kanan, medan landai, medan miring- basement, bertingkat), ada yg luas ada yg sempit berbagai macam jenis parkiran …;0
https://lh3.googleusercontent.com/a-/ALV-UjXYerURNI1F4p0B8U3CxvDzmaXP06Te3IZP3PL0b7ysYvg=w45-h45-p-rp-mo-ba2-br100;Siti Rahmah;Positive;sebulan lalu;Buat yang suk binatang pas lagi ke mall bisa kunjungi tempat ini ya, ada di sky level PVJ, pokonya cari aja ada di deket ice skating. Bisa ngasih makan hamster, burung, kambing, dll. Binatang nya juga jinak jinak;0
https://lh3.googleusercontent.com/a-/ALV-UjXQADL7Lt68cDemoaZI2ezb3CimtbKqfaosgUTDzLpunF1G=w45-h45-p-rp-mo-ba6-br100;ANDRIE MR;Positive;setahun lalu;Mall lengkap bahkan ada permainan ice skating, taman bunga, hewan dan air terjun buatan di sky level mall. Jadi tempat rekreasi juga pas lah... Bersih... Tapi tolong toiletnya sering-aering dibersihkan.;46
https://lh3.googleusercontent.com/a-/ALV-UjURfrNIe-ALcuC8vWiCxwqpCAejvYjMsk_we0HyCOMXlg4=w45-h45-p-rp-mo-ba4-br100;Stephani Thalia Susanty;Positive;4 hari lalu;Tempat enak untuk jalan-jalan dengan teman.. Sayangnya jarang ada kursi untuk duduk jadi harus masuk restoran dulu kalau mau duduk...;0
https://lh3.googleusercontent.com/a-/ALV-UjX5iFMjKn4FprEPE1Uufqwu7H3G-Y-SDl4h3i-dkeTmPX4=w45-h45-p-rp-mo-ba5-br100;Muhammad Rayhan Bustam;Positive;3 bulan lalu;Banyak store segala rupa. Mulai dari makanan, fashion, dll. One stop entertaining. Salah satu mall terlengkap di Bandung. Sekarang sudah banyak spot ramah anak yg free jg di sini. Ada taman, mini zoo, dll. di rooftopnya. Recommended utk …;2
https://lh3.googleusercontent.com/a/ACg8ocIY0NzHzuIpKIVO_6OjMiUsEysFEI6C6mWByc_oHBenK3k=w45-h45-p-rp-mo-ba4-br100;Novia Sari;Positive;setahun lalu;One of the best mall in Bandung. banyak tempat makan, ada outdoor space, banyak tempat bermain untuk anak, one stop solution if you want to hangout with your friends, namun menurut saya ada sedikit kekurangan, jika kalian bukan berasal dari Bandung akan sulit mencari toilet di mall ini. selebihnya tempat ini sangat oke;9
https://lh3.googleusercontent.com/a-/ALV-UjVxOUAdRvIzM7vhTckFDYYJE2dgVbK1ml1QikgjUSUjR80=w45-h45-p-rp-mo-ba4-br100;wayang wong;Positive;2 bulan lalu;Mall yang ikonik di bandung. Ada parkir di basemen dan tempat parkir luar yang cukup luas (taping emoney, untuk buka gate portal parkir bukan sensor tangan atau tombol ya tapi taping emoney). …;0
https://lh3.googleusercontent.com/a-/ALV-UjXjQ8Gb0pdEwjKR_ID6N1GmlniP65m9ls0KI7LMirVWkdGL=w45-h45-p-rp-mo-ba6-br100;Andi Asdiana Ekasari;Positive;4 bulan lalu;Tempat belanja yang lumayan lengkap di kota Bandung. Nyari barang branded ada, tempat nongkrong bareng keluarga ada. Apalagi kalo ada even, tempat ini bakal rame banget. Mau menepi sejenak bisa nyari tempat ngopi di sudut mall sambil mikirin problematika hidup..hadeuh.;0
https://lh3.googleusercontent.com/a-/ALV-UjUNOnfGh_U86Snu7DrnqatpXkCvS7s2xAh0sdFEFLwC3KE=w45-h45-p-rp-mo-ba6-br100;Ayah Neno;Positive;2 tahun lalu;Amazing!!!!!, but.....;0
https://lh3.googleusercontent.com/a-/ALV-UjXwR9UW8fDH7PAZvJLmem3s1MeplsPIYsaPdjiIxXdGUrs=w45-h45-p-rp-mo-ba4-br100;Thya Aristha;Positive;2 bulan lalu;Ada taman & air terjun buatan di roof top nya. Ada kebun bunga matahari cukup bayar 10rb /org udh bsa fto2 ala kebun bunga. Ada feeding animal juga byr 55rb klo gak salah. Lupa kefoto. Mall nya asik, estetik bgt spot foto & modern bgt;0
https://lh3.googleusercontent.com/a-/ALV-UjUN8mkgSQ_OyGeBSIpCpQHyqBqAnRHd2-AYp6s945COzBC3=w45-h45-p-rp-mo-ba4-br100;Yohanes Aris;Positive;setahun lalu;Kalo mau jalan-jalan sambil cuci mata, Mall ini emang paling cocok + banyak tempat makannya.. Kelilingi2 sampe puas..;0
https://lh3.googleusercontent.com/a-/ALV-UjW24dPHJQGOYloY2g0c8J3Na4BgE_kQmcBXw7nTOKrzGkYy=w45-h45-p-rp-mo-ba4-br100;Julia Rosmaya;Positive;2 minggu lalu;Konsep mall nya gak biasa. Dibuat seperti pertokoan lengkap dengan catwalk-nya. Isinya lumayan lengkap. Cocok buat keluarga;0
https://lh3.googleusercontent.com/a-/ALV-UjWoxV7NdW881GuhcKlk3ogVqzjMZcP-skD5YTPrMJZXEnWm=w45-h45-p-rp-mo-ba4-br100;SHANDHRA OKA;Positive;10 bulan lalu;Ya seperti mall pada umumnya, tp tenantnya banyak mallnya juga luas banget, cocok yg bawa anak lg aktif²nya lari² atau explore sana sini. Blm berubah mallnya msh sama seperti dlu;0
https://lh3.googleusercontent.com/a-/ALV-UjV4RqoIGsjXK14MuHoac5kU0spTfVmMrbDKutguzyrOc9I=w45-h45-p-rp-mo-ba6-br100;Farid Muhyidin;Positive;setahun lalu;Di lantai Paling Atas ada Area Bermain luas dan ada air terjun buatan, enak untuk bermain bersama keluarga, area parkir mobilnya yang memang masih perlu di perbaiki, Marking dan arah parkir kurang jelas untuk basementnya;47
https://lh3.googleusercontent.com/a-/ALV-UjXChdr9eRbgVVdRXZjqkbbUCxC5W-Bxwa14jdnw4DyRq2JQ=w45-h45-p-rp-mo-ba3-br100;陳昤燊Sutisno;Positive;2 bulan lalu;Pvj, enak buat jalan-jalan, namun kekurangannya menurut saya pribadi :;0
https://lh3.googleusercontent.com/a-/ALV-UjUTZIwu9T6My-AE6t5ZqEmonKQr3wpYVY_w_BdQEKsK_k4=w45-h45-p-rp-mo-br100;elizabeth wijaya;Positive;sebulan lalu;Lengkap, dekornya lucu2 sesuai event,  toiletnya tolong ditingkatkan lg kebersihan nya dan jumlahnya, soalnya tiap mau ke toilet selalu antri;0
https://lh3.googleusercontent.com/a-/ALV-UjW2QODXOb28rezpPKgAZcjIyfxinYDrnci5TbIkIFtmqA=w45-h45-p-rp-mo-ba2-br100;Gatria G. Rochmano;Positive;4 bulan lalu;tuk area bermain bgus, jalan2 dan healing, hanya tuk tempat, prasarana, dan sarana ibadah, seperti ketersediaan mukena, sarung, dll.. hrus di perbaiki dan di tingkatkan, karna mayoritas pengunjung atau pekerja adalah muslim, dan bisa sja ad yg mau ibadah tp lula bawa peralatan.;0
https://lh3.googleusercontent.com/a-/ALV-UjW79ktAD17MHfgDUs49s1_8wsGLnTVHZLQS01T2fF7VcsA=w45-h45-p-rp-mo-ba3-br100;Nabil Arsy Rabbani;Positive;5 bulan lalu;Toilet yang jauh dan jumlah titiknya sedikit menyebabkan antrian cukup panjang.;0
https://lh3.googleusercontent.com/a/ACg8ocKFgiAB2E546T2fTnAkqLwrF9DiE6wWrNTcAaa37c85=w45-h45-p-rp-mo-ba5-br100;Ika Wahyuningtyas;Positive;setahun lalu;PVJ salah satu mall yang ada di bandung yang paling luas dan lengkap. banyak brand-brand yang ada seperti Guess, H&M, Zara, Uniqlo, Charles & Keith, Body Shop, Victoria Secret, dll. makanan juga banyak macamnya yang paling kusuka ada booth …;4
https://lh3.googleusercontent.com/a-/ALV-UjXPWXlIn_DpxlTHIaSZwOVjKSvOu3F7_1aWxgh1lEPsJRw=w45-h45-p-rp-mo-ba5-br100;Wisnu Wardhana;Positive;sebulan lalu;Mall ini berdiri saat gue masih kuliah dulu, sampai skrg bbrapa kali masih kesini, tapi makin kesini akses jalan nya makin macet, dan parkiran nya makin bikin stres;0
https://lh3.googleusercontent.com/a-/ALV-UjVy9XRMqHzM6ssmw4wIOm5tw5Gj8Y2Ji6YBF5khe7YpYi8=w45-h45-p-rp-mo-ba6-br100;Fachry Adrian;Positive;setahun lalu;Mall terlengkap di Bandung(mungkin).;0
https://lh3.googleusercontent.com/a-/ALV-UjXeVOaOo-UJQYykyBYxVWJ-FEGmtXD6OKGfpUYfl1puSGU=w45-h45-p-rp-mo-ba5-br100;Anggi;Positive;setahun lalu;Salah satu mall terlengkap di Bandung,;0
https://lh3.googleusercontent.com/a-/ALV-UjXmSk8MOfJJaG-Nhq77R6rMUqNpRmQpLF-Cck4nvqAgYoDE=w45-h45-p-rp-mo-ba2-br100;miftah jannah;Positive;setahun lalu;di mallnya  udah mulai rame sih , cmn untuk spot foto yg ke taman bunga matahari berantakan banget dan banyak yg gak keurus gitu .;3
https://lh3.googleusercontent.com/a-/ALV-UjUtM8G7A_4eop2sZfHJjk_gq8_6wCI1cDIxoHli2TuKFlYs=w45-h45-p-rp-mo-ba7-br100;Emma Eryanti;Positive;setahun lalu;Mal ternama di Bandung yang banyak tenant branded nya, sehingga banyak digemari baik bagi warga Bandung ataupun bagi wisatawan. Suasananya terbuka dan dibuat asri. Ada taman di atas bangunan mall. …;4
https://lh3.googleusercontent.com/a-/ALV-UjWuZkOtn4t_WztWs9RdIRXKvSgxMhSMA7HeeEPjVMvFYiQ=w45-h45-p-rp-mo-ba5-br100;Fatah Shihabul Millah;Positive;setahun lalu;Mall nya luas, fasilitas parkir kendaraan nya juga luas dan suasanya nya nyaman. Kalo yg pertama kesini pasti bigung karena luas dan tidak ada papan nama untuk ke lantai atas/bawah dan tidak ada satpam di dalam untuk di tanya.;0
https://lh3.googleusercontent.com/a/ACg8ocLRtOOUFgTZDESZ809C1Fs_yJ6lP5bJTx8x7jSnlKg=w45-h45-p-rp-mo-br100;Cupa Mbim;Positive;sebulan lalu;Bagus.. lengkap.. cuma toilettnyaa jauh dan terbatas.. tiap mau ke toilet selaluu antriii gaesss🥹🥹🥹🥹arah ke mol jg muacett nya ampunnn... …;0
https://lh3.googleusercontent.com/a/ACg8ocL_k48K196LvVYZvcecl1xmxiyZFyormMD4HiUfW98c=w45-h45-p-rp-mo-br100;Social media Acc;Positive;4 bulan lalu;"Mall nya bagus semuanya bagus, ada tempat air mancur gede indah sekali, tempatnya sangat luas banyak tempat makan dan brand"" lain, mines nya toilet nya jauh kek berusaha nyari portal, sekalinya nemu cm 2 tempat toilet, itu pun kalo penuh bisa ngompol💀 tolong perbanyakin tempat toilet nya ya di sekitar tempat jangan terlalu jauh …";0
https://lh3.googleusercontent.com/a/ACg8ocJG7cayUdjXEaAoAebNGlDxdNEoUHRMtIkrOnUO5EtW=w45-h45-p-rp-mo-ba6-br100;hartanto saja;Positive;4 tahun lalu;Siapkan kartu parkir (emoney), lebih hati2 krn jalan tempat parkir cukup sempit.;0
https://lh3.googleusercontent.com/a-/ALV-UjVloRgj-DZ70OptFaBUKHyG1Drr8wWMnZQyqx_XgiHMjoM=w45-h45-p-rp-mo-ba4-br100;Reza Fachriza;Positive;setahun lalu;Gede bener tempatnya, banyak destinasi belanja mantap. Cuma ya karena kegedean jd bingung mau kemana2 harus nanyain satpam yang sangat sedikit jumlahnya;0
https://lh3.googleusercontent.com/a-/ALV-UjU1NiE9Nq7ENMUVxOVUdVnSbQli0NG_2SxaqUnFa_q1kw=w45-h45-p-rp-mo-ba4-br100;Erwan Erwan;Positive;2 bulan lalu;Gedung parkirnya kurang enak sempit utk naik turun nya, mall nya cukup baik, lebih banyak pilihan makanan dan fashion, lantai nya kurang nyaman tidak rata, ada naik turun sedikit atau miring sedikit;0
https://lh3.googleusercontent.com/a-/ALV-UjWxFnZwX1kZJiMb-xCFBb1WoKIAaXYwFQdY2JUt98SYYTE=w45-h45-p-rp-mo-ba3-br100;Naimah Putri Kamila;Positive;2 bulan lalu;Sirkulasi dalam mall kurang jelas, penamaan tiap lantainya sulit dihapal, lokasi toilet dan musholla tidak strategis.;0
https://lh3.googleusercontent.com/a/ACg8ocJFXFIppSEElnXAKQzBA0_oVy3DGYcomSU8v5Aji3GD1UQ=w45-h45-p-rp-mo-ba4-br100;Temmy;Positive;11 bulan lalu;Cukup bagus dan menarik sayang kurang di sediakan tempat untuk duduk2 bilah lelah berjalan.;0
https://lh3.googleusercontent.com/a-/ALV-UjWpUaoTwCIo0VuCWKOGWCuZGxeuriXjg59NehOgVaFKEavb=w45-h45-p-rp-mo-ba7-br100;Aaaarumi;Positive;2 tahun lalu;Gaperlu panjang lebar, orang bandung pasti dah tau tempat ini. Apalagi orang Jakarta wkwk …;43
https://lh3.googleusercontent.com/a-/ALV-UjX6jFLBlQVT0cKkv1azt-Xi_c4LbHHmyTbyEEmMxpYROJY=w45-h45-p-rp-mo-ba5-br100;Rifqi Ichsan Nuraziizi (Tojil);Positive;4 tahun lalu;Mall yg meluas ini, salah stu mall high class di bandung. Cari barang branded  disini. apalagi resto dan tempat hang out. banyak pilihannya. Parkir luas, namun ngga cukup untuk antusiasme pengunjung di weekend. Jadi cari parkir kadang kudu …;10
https://lh3.googleusercontent.com/a-/ALV-UjUkGYkKo5IBZaXpFuJhGrkvhTaOZXhY0eHt9Zj2ycXyPAg=w45-h45-p-rp-mo-ba5-br100;Alfi Syahri;Positive;sebulan lalu;Mall nya besar, bersih.;0
https://lh3.googleusercontent.com/a-/ALV-UjVlLUnxatiCOH_f6n7_RMp8n3zfXMrw0vIrqvIWww6AMaU=w45-h45-p-rp-mo-ba5-br100;Niky Purbawisesa;Positive;4 bulan lalu;Mall andalan klo ke bandung, semi outdoor dan tenant nya komplit bgt, kmrn makan di rempah bistro, okeh lah dr sisi rasa 8, tempat 8,5, servis 8;0
https://lh3.googleusercontent.com/a-/ALV-UjXYDkCJQWcr48qkHV2CxMefvwZHFvgWPNX-V5eKYcoDGXU=w45-h45-p-rp-mo-ba3-br100;Anggi Purwandini;Positive;setahun lalu;Mall terluas tapi toiletnya susah ditemukan, ditambah ATM center juga jarang;0
https://lh3.googleusercontent.com/a/ACg8ocLHNHuScDGb2-sUrlqmljloZl0DvOM1WeMAzyGuCPO0=w45-h45-p-rp-mo-br100;Exordial OT9;Positive;2 bulan lalu;Konsep mallnya sy suka, cuman sayangnya musholanya tidak tersedia di setiap lantai, jd agak ribe.;0
https://lh3.googleusercontent.com/a-/ALV-UjXrGZmo5JOMJdE1s_z8f6U9sxXCox_3Vebr2mOIqQ3uWiw=w45-h45-p-rp-mo-ba3-br100;Afriyanti Wulandari;Positive;seminggu lalu;Tempat berbelanja yg nyaman, banyak tokonya, parkirnya yg kurang besar;0
https://lh3.googleusercontent.com/a-/ALV-UjVhHdut3Mr91UU7Csy2zUh9z0bHLhEwtdvrhcNONrPkK7Q=w45-h45-p-rp-mo-ba5-br100;Annisa Nadhira;Positive;setahun lalu;Salah satu mall favoritku di Bandung, jadi pilihan alternatif kalau tidak bisa hangout ke alam. Karena, di Paris Van Java Mall terdapat taman, sawah, kumpulan binatang, bahkan air terjun di samping toko² dan restoran yang bejibun. Inilah yang jadi daya tarik utama menurutku. Hebat sekali;0
https://lh3.googleusercontent.com/a/ACg8ocIvAWjkZny7iSyFTHiQOMV4cbRgKGHReDrtGQnge9ulVA=w45-h45-p-rp-mo-ba4-br100;Hanifa Muslimah;Positive;2 bulan lalu;Salah satu musholla ada di belakang hnm, masuk aja ke hnm lurus terus ke belakang, deket parkiran. Mall elit mushollanya mungkin  bisa lebih diperbaiki lagi;0
https://lh3.googleusercontent.com/a-/ALV-UjXqhTRQhjLXPpUXtkpqVp6MdUGjL09HFyM4Zns1HQ3UlBE=w45-h45-p-rp-mo-ba4-br100;Nabila Amalia;Positive;6 bulan lalu;Mall besar dan lengkap di Kota Bandung, Isinya brand2 besar semua.  Ambience 9/10;0
https://lh3.googleusercontent.com/a-/ALV-UjVG2FRdgP6MSOP9Fq4zXuPKcVRofdBSsMHVtrcV8aTLmhSc=w45-h45-p-rp-mo-ba5-br100;Ivan Maulana;Positive;setahun lalu;Mall yang menyongsong tema unik seperti di luar negeri.;0
https://lh3.googleusercontent.com/a-/ALV-UjV51GZ2FM-6h9mZbLa0F37A6NxlWn7e2ifM_u7krKX2xP8=w45-h45-p-rp-mo-ba6-br100;Yudhia Nugraha;Positive;2 bulan lalu;Mall yg selalu ramai, banyak tenant yg baru. Harga diatas mall2 yg lain, tp klo cari kualitas bisa menjadi salah satu reference;0
https://lh3.googleusercontent.com/a/ACg8ocLEaL5ffFc_cnLxwm87qVVfD5GgYUAhTA3IiCi6Q1Sx=w45-h45-p-rp-mo-ba3-br100;rosmeyda givani;Positive;seminggu lalu;Agak membingungkan pertama kali ke sini 🤣  krna penunjuk arahnya dll nya tidak terlihat mata.. …;0
https://lh3.googleusercontent.com/a-/ALV-UjU36CzjuWu6Oo08yg3SECYJ721oWKeigiheUvpl0ncHVDY=w45-h45-p-rp-mo-ba4-br100;Mustaqim Dm;Positive;sebulan lalu;rame dan macet banget. tapi oke dalemnya.;0
https://lh3.googleusercontent.com/a-/ALV-UjWOm0SYTlYONI3BppSOuJLDnKb1qMw2VKhj5IFs5xofDQ=w45-h45-p-rp-mo-ba6-br100;Udin Badut clown;Positive;5 tahun lalu;Kreatifitas terlihat di taman gantung dan air terjun artifisial di lantai atas, saat ke sini bareng istri ada festival bunga matahari. …;10
https://lh3.googleusercontent.com/a/ACg8ocKQ3Nq4g9ERuvbzhE48NN8WWQ0N9AEQrxQ5jFfGuKaJ=w45-h45-p-rp-mo-ba4-br100;Amaniyya Hanifah;Positive;5 bulan lalu;salah satu mall yang bagus untuk hangout, estetik, dan juga lumayan lengkap. Cuma waktu saya kesana sign toiletnya kurang terlihat sehingga susah untuk cari toilet dan musholla yang jauh;0
https://lh3.googleusercontent.com/a-/ALV-UjUc68fNZZsenKeli67Ynl39i5v_kKS0H9elwTclJEOP7A=w45-h45-p-rp-mo-ba3-br100;Rizqaria Muflikhah;Positive;4 bulan lalu;Banyak tenant nya;0
https://lh3.googleusercontent.com/a-/ALV-UjXLrocqzVGeUUbW2AfhWGwO20DYpWV7xuIDHeL2yy7rm64w=w45-h45-p-rp-mo-ba4-br100;IRFAN _;Positive;setahun lalu;Tempat nyaman enak buat jalan cuman mungkin pasilitas ibadah nya bisa lebih di perlebar biar ga terlalu ngantri;0
https://lh3.googleusercontent.com/a-/ALV-UjXDDliUr-PaaIWd-kjkpaQ68mr8udKKiuYC72ECxjyqkw=w45-h45-p-rp-mo-ba4-br100;Gita Adonara;Positive;4 tahun lalu;Sejauh ini, sepengetahuan saya mall inilah yang paling menyenangkan untuk dikunjungi. Bahkan ketika kita tidak berkeinginan untuk berbelanja. Segala brand barang ternama ada disini. Ada banyak pilihan aneka resto dan cafe.;7
https://lh3.googleusercontent.com/a-/ALV-UjXmjuZ-qIV31RCQmvSBv1kccVJwdTMaRQAx9tjfbDfZBQ=w45-h45-p-rp-mo-ba4-br100;Furry Sasti;Positive;2 tahun lalu;Kalo nginep di seputaran Sukajadi, wajib banget mampir ke PVJ dgn berjalan kaki atau naik angkot. Pengennya sih bawa kendaraan sendiri, tp apalah daya gak punya boil di bandung😂 krn mmg pengalaman saat nunggu Ojol di mari #Beeuhhh Superb …;7
https://lh3.googleusercontent.com/a-/ALV-UjWN0mIAzGT-5Gc36rgdxLwqJ_FVo4TAkBXafqTgHPN57so=w45-h45-p-rp-mo-ba4-br100;Evan;Positive;2 tahun lalu;Always going to this place for walking and shopping around but we can't deny, this mall is quite crowded, but overall the services offered was enough to invite more shopper to go to here. …;3
https://lh3.googleusercontent.com/a-/ALV-UjWyPDiz9clignyGWjca4iJJ7I9FsRVmdPlIzixL5a6BWw=w45-h45-p-rp-mo-ba5-br100;adelita karismawati;Positive;4 tahun lalu;Selalu suka berbelanja atau sekedar menikmati akhir pekan di Paris Van Java Mall.;0
